{
  "outcome": "generated_report",
  "output_path": "samples\\example-outputs\\reports\\case-008.csv",
  "policy_decision": {
    "approval_required": false,
    "decision": "allowed",
    "excluded_fields": [],
    "reason_codes": [
      "allowed"
    ]
  },
  "reason_codes": [
    "allowed"
  ],
  "report_plan": {
    "filters": {
      "order_date": {
        "end": "2025-12-31",
        "start": "2025-01-01"
      },
      "region": [
        "EMEA"
      ]
    },
    "group_by": [
      "month"
    ],
    "metrics": [
      "revenue"
    ],
    "output_format": "csv",
    "source_table": "SalesOrders"
  },
  "request_id": "case-008",
  "requester_id": "u-1002",
  "structured_request": {
    "date_range": {
      "end": "2025-12-31",
      "label": "2025",
      "start": "2025-01-01"
    },
    "dimensions": [
      "month"
    ],
    "filters": {
      "region": [
        "EMEA"
      ]
    },
    "metrics": [
      "revenue"
    ],
    "output_format": "csv",
    "purpose": "annual planning pack",
    "report_type": "monthly_trend"
  },
  "timestamp": "2026-05-05T13:49:24+00:00"
}